{"artifacts":{"launch_log":{"path":"evidence/009c/runs/20260727T195236Z-034587d4b31f8ce5/launch.log","sha256":"6441416c3c5bcbef4caa386c5b527518b4e9f4025f0f58a45e875df1c8932c4f"},"map_runtime":{"path":"evidence/009c/runs/20260727T195236Z-034587d4b31f8ce5/map-runtime.json","sha256":"66330cab840fea39f05088e549318c388ca7873b0fb2effed4f2a49ac325f4e2"},"observer_log":{"path":"evidence/009c/runs/20260727T195236Z-034587d4b31f8ce5/observer.log","sha256":"e3b0c44298fc1c149afbf4c8996fb92427ae41e4649b934ca495991b7852b855"},"observer_raw":{"path":"evidence/009c/runs/20260727T195236Z-034587d4b31f8ce5/observer-raw.json","sha256":"67c688a9fcc3a0f87573bc060af9e1af7c2edda81e12a2862430d9565e81275e"},"run_metadata":{"path":"evidence/009c/runs/20260727T195236Z-034587d4b31f8ce5/run-metadata.json","sha256":"2edeafd92d98af209273a0d5d5f2df811a835b142fb3e0d44206ea24522a5acf"}},"collection":{"clock_boundary":"Order and causality use only collector monotonic receipt timestamps; preserved source stamps and host UTC are provenance only, and DDS/network order is not independently proved.","collector_id":"de4sdv.scenario_observer.v1","monotonic_end_s":8338.143749936,"monotonic_start_s":8334.125306753,"observations":[{"host_utc":null,"kind":"diagnostic","payload":{"level":"OK","node":"autonomous_emergency_braking","task":"aeb_emergency_stop"},"receipt_monotonic_s":8334.35774124,"source_stamp":"1785181969.605007111"},{"host_utc":null,"kind":"instrument_status","payload":{"available":true,"topic":"/diagnostics"},"receipt_monotonic_s":8334.35774124,"source_stamp":null},{"host_utc":null,"kind":"autonomous_availability","payload":{"available":true},"receipt_monotonic_s":8334.358501834,"source_stamp":null},{"host_utc":null,"kind":"instrument_status","payload":{"available":true,"topic":"/system/operation_mode/availability"},"receipt_monotonic_s":8334.358501834,"source_stamp":null},{"host_utc":null,"kind":"emergency_operator_status","payload":{"state":"AVAILABLE"},"receipt_monotonic_s":8334.358726104,"source_stamp":null},{"host_utc":null,"kind":"instrument_status","payload":{"available":true,"topic":"/system/mrm/emergency_stop/status"},"receipt_monotonic_s":8334.358726104,"source_stamp":null},{"host_utc":null,"kind":"nominal_command","payload":{"acceleration_mps2":1.0,"speed_mps":5.0},"receipt_monotonic_s":8334.359099856,"source_stamp":"1785181969.646478625"},{"host_utc":null,"kind":"instrument_status","payload":{"available":true,"topic":"/control/trajectory_follower/control_cmd"},"receipt_monotonic_s":8334.359099856,"source_stamp":null},{"host_utc":null,"kind":"emergency_command","payload":{"acceleration_mps2":1.0,"speed_mps":5.0},"receipt_monotonic_s":8334.359415525,"source_stamp":"1785181969.646478625"},{"host_utc":null,"kind":"gate_emergency_status","payload":{"emergency":false},"receipt_monotonic_s":8334.359597936,"source_stamp":null},{"host_utc":null,"kind":"gate_command","payload":{"acceleration_mps2":1.0,"path":"nominal"},"receipt_monotonic_s":8334.359833504,"source_stamp":"1785181969.646478625"},{"host_utc":null,"kind":"instrument_status","payload":{"available":true,"topic":"/control/command/control_cmd"},"receipt_monotonic_s":8334.359833504,"source_stamp":null},{"host_utc":null,"kind":"emergency_operator_status","payload":{"state":"AVAILABLE"},"receipt_monotonic_s":8334.361649077,"source_stamp":null},{"host_utc":null,"kind":"nominal_command","payload":{"acceleration_mps2":1.0,"speed_mps":5.0},"receipt_monotonic_s":8334.361898917,"source_stamp":"1785181969.666560339"},{"host_utc":null,"kind":"gate_emergency_status","payload":{"emergency":false},"receipt_monotonic_s":8334.362058032,"source_stamp":null},{"host_utc":null,"kind":"gate_command","payload":{"acceleration_mps2":1.0,"path":"nominal"},"receipt_monotonic_s":8334.362280574,"source_stamp":"1785181969.666560339"},{"host_utc":null,"kind":"nominal_command","payload":{"acceleration_mps2":1.0,"speed_mps":5.0},"receipt_monotonic_s":8334.371996146,"source_stamp":"1785181969.686543488"},{"host_utc":null,"kind":"gate_emergency_status","payload":{"emergency":false},"receipt_monotonic_s":8334.373115195,"source_stamp":null},{"host_utc":null,"kind":"gate_command","payload":{"acceleration_mps2":1.0,"path":"nominal"},"receipt_monotonic_s":8334.373381036,"source_stamp":"1785181969.686543488"},{"host_utc":null,"kind":"emergency_operator_status","payload":{"state":"AVAILABLE"},"receipt_monotonic_s":8334.374014005,"source_stamp":null},{"host_utc":null,"kind":"emergency_command","payload":{"acceleration_mps2":1.0,"speed_mps":5.0},"receipt_monotonic_s":8334.374265221,"source_stamp":"1785181969.686543488"},{"host_utc":null,"kind":"odometry","payload":{"acceleration_mps2":0.9999999993541999,"speed_mps":2.041773786533187},"receipt_monotonic_s":8334.376159839,"source_stamp":"1785181969.691279954"},{"host_utc":null,"kind":"instrument_status","payload":{"available":true,"topic":"/localization/kinematic_state"},"receipt_monotonic_s":8334.376159839,"source_stamp":null},{"host_utc":null,"kind":"diagnostic","payload":{"level":"OK","node":"autonomous_emergency_braking","task":"aeb_emergency_stop"},"receipt_monotonic_s":8334.390041313,"source_stamp":"1785181969.705024427"},{"host_utc":null,"kind":"nominal_command","payload":{"acceleration_mps2":1.0,"speed_mps":5.0},"receipt_monotonic_s":8334.392721999,"source_stamp":"1785181969.707267484"},{"host_utc":null,"kind":"gate_emergency_status","payload":{"emergency":false},"receipt_monotonic_s":8334.393493472,"source_stamp":null},{"host_utc":null,"kind":"gate_command","payload":{"acceleration_mps2":1.0,"path":"nominal"},"receipt_monotonic_s":8334.393765042,"source_stamp":"1785181969.707267484"},{"host_utc":null,"kind":"mrm_state","payload":{"behavior":"NONE","state":"NORMAL"},"receipt_monotonic_s":8334.398474691,"source_stamp":null},{"host_utc":null,"kind":"instrument_status","payload":{"available":true,"topic":"/system/fail_safe/mrm_state"},"receipt_monotonic_s":8334.398474691,"source_stamp":null},{"host_utc":null,"kind":"odometry","payload":{"acceleration_mps2":0.9999999994967856,"speed_mps":2.0667618025220613},"receipt_monotonic_s":8334.401226997,"source_stamp":"1785181969.716297540"},{"host_utc":null,"kind":"emergency_command","payload":{"acceleration_mps2":1.0,"speed_mps":5.0},"receipt_monotonic_s":8334.40725641,"source_stamp":"1785181969.707267484"},{"host_utc":null,"kind":"emergency_operator_status","payload":{"state":"AVAILABLE"},"receipt_monotonic_s":8334.408106609,"source_stamp":null},{"host_utc":null,"kind":"nominal_command","payload":{"acceleration_mps2":1.0,"speed_mps":5.0},"receipt_monotonic_s":8334.411949642,"source_stamp":"1785181969.726448212"},{"host_utc":null,"kind":"gate_emergency_status","payload":{"emergency":false},"receipt_monotonic_s":8334.412866117,"source_stamp":null},{"host_utc":null,"kind":"gate_command","payload":{"acceleration_mps2":1.0,"path":"nominal"},"receipt_monotonic_s":8334.413229949,"source_stamp":"1785181969.726448212"},{"host_utc":null,"kind":"odometry","payload":{"acceleration_mps2":0.9999999996080454,"speed_mps":2.091756731513393},"receipt_monotonic_s":8334.426215172,"source_stamp":"1785181969.741245649"},{"host_utc":null,"kind":"nominal_command","payload":{"acceleration_mps2":1.0,"speed_mps":5.0},"receipt_monotonic_s":8334.431995802,"source_stamp":"1785181969.746448866"},{"host_utc":null,"kind":"gate_emergency_status","payload":{"emergency":false},"receipt_monotonic_s":8334.432996507,"source_stamp":null},{"host_utc":null,"kind":"gate_command","payload":{"acceleration_mps2":1.0,"path":"nominal"},"receipt_monotonic_s":8334.433358514,"source_stamp":"1785181969.746448866"},{"host_utc":null,"kind":"autonomous_availability","payload":{"available":true},"receipt_monotonic_s":8334.434973403,"source_stamp":null},{"host_utc":null,"kind":"emergency_command","payload":{"acceleration_mps2":1.0,"speed_mps":5.0},"receipt_monotonic_s":8334.440555172,"source_stamp":"1785181969.746448866"},{"host_utc":null,"kind":"emergency_operator_status","payload":{"state":"AVAILABLE"},"receipt_monotonic_s":8334.441616168,"source_stamp":null},{"host_utc":null,"kind":"odometry","payload":{"acceleration_mps2":0.999999999694727,"speed_mps":2.116906933506605},"receipt_monotonic_s":8334.452129392,"source_stamp":"1785181969.766419309"},{"host_utc":null,"kind":"nominal_command","payload":{"acceleration_mps2":1.0,"speed_mps":5.0},"receipt_monotonic_s":8334.453437573,"source_stamp":"1785181969.766495922"},{"host_utc":null,"kind":"gate_emergency_status","payload":{"emergency":false},"receipt_monotonic_s":8334.45372684,"source_stamp":null},{"host_utc":null,"kind":"gate_command","payload":{"acceleration_mps2":1.0,"path":"nominal"},"receipt_monotonic_s":8334.45407963,"source_stamp":"1785181969.766495922"},{"host_utc":null,"kind":"diagnostic","payload":{"level":"OK","node":"autonomous_emergency_braking","task":"aeb_emergency_stop"},"receipt_monotonic_s":8334.456575824,"source_stamp":"1785181969.771096988"},{"host_utc":null,"kind":"nominal_command","payload":{"acceleration_mps2":1.0,"speed_mps":5.0},"receipt_monotonic_s":8334.472373869,"source_stamp":"1785181969.786498464"},{"host_utc":null,"kind":"gate_emergency_status","payload":{"emergency":false},"receipt_monotonic_s":8334.473485621,"source_stamp":null},{"host_utc":null,"kind":"gate_command","payload":{"acceleration_mps2":1.0,"path":"nominal"},"receipt_monotonic_s":8334.473878863,"source_stamp":"1785181969.786498464"},{"host_utc":null,"kind":"emergency_operator_status","payload":{"state":"AVAILABLE"},"receipt_monotonic_s":8334.474837261,"source_stamp":null},{"host_utc":null,"kind":"emergency_command","payload":{"acceleration_mps2":1.0,"speed_mps":5.0},"receipt_monotonic_s":8334.47522871,"source_stamp":"1785181969.786498464"},{"host_utc":null,"kind":"odometry","payload":{"acceleration_mps2":0.9999999997626074,"speed_mps":2.142069744501324},"receipt_monotonic_s":8334.477203686,"source_stamp":"1785181969.791611754"},{"host_utc":null,"kind":"nominal_command","payload":{"acceleration_mps2":1.0,"speed_mps":5.0},"receipt_monotonic_